<?xml version="1.0" encoding="UTF-8"?>
<!--
ACIT 4850
Damian Kim
Pablo Ramos

Period perspective
-->
<?xml-stylesheet type='text/xsl' href='Period.xsl'?>
<timetable xmlns:xsi="http://www.w3.org/2001/XMLSchema-instance"
xsi:noNamespaceSchemaLocation="timetable.xsd">
<period start="1030" end="1220">
    <booking type="lab" day="Tuesday">
        <name>ACIT 4620</name>
        <instructor>Bethany Edmunds</instructor>
        <room>SE12 306</room>                   
    </booking>
    <booking type="lab" day="Wednesday">
        <name>ACIT 4660</name>
        <instructor>Steve Fabzinsk</instructor>
        <room>SE12 306</room>
    </booking>
    <booking type="lab" day="Thursday">
        <name>ACIT 4850</name>
        <instructor>James Perry</instructor>
        <room>SE12 320</room>
    </booking>         
</period>
</timetable>
